442,442,618,wed aug 07 14:06:41 +0000 2019,nasa ,nasa,"our @nasafermi gamma-ray telescope studies extraordinary extragalactic events from supermassive black holes to merging neutron stars. ?while it's working to unravel mysteries of our universe, we're breaking down misconceptions of its impressive portfolio: go.nasa.gov/2oie049 pic.twitter.com/pzkojajtrb",https://go.nasa.gov/2oie049 https://twitter.com/nasa/status/1159103571759173633/video/1,regular tweet,en,-2,991,5832,34010709,298,34010709,0.0,6823,0.02,sprinklr,go.nasa.gov ,go.nasa.gov/2oie049 ,https://twitter.com/nasa /status/1159103571759173633,https://pbs.twimg.com/profile_images/1091070803184177153/ti2qitoi_normal.jpg,,,,,,,1.1591e+18
457,457,638,thu sep 12 15:09:30 +0000 2019,nasa ,nasa,"""we choose to go to the moon..."" #otd in 1962, president kennedy spoke at @riceuniversity about the nation's space exploration plans. now, our #artemis program will lead the next era of exploration by building a sustainable presence on the lunar surface: go.nasa.gov/2ztex3k pic.twitter.com/symonacuqj",twitter analytics for #otd twitter analytics for #artemis https://go.nasa.gov/2ztex3k https://twitter.com/nasa/status/1172165345886515203/photo/1,regular tweet,en,4,954,4874,34010706,298,34010706,0.0,5828,0.02,sprinklr,go.nasa.gov ,go.nasa.gov/2ztex3k ,https://twitter.com/nasa /status/1172165345886515203,https://pbs.twimg.com/profile_images/1091070803184177153/ti2qitoi_normal.jpg,,,,,,,1.17217e+18
458,458,639,tue jul 02 10:40:17 +0000 2019,nasa ,nasa,live now: we?re testing our @nasa_orion spacecraft's launch abort system to ensure @nasa_astronauts can safely get away from their launch vehicle in the case of an emergency after liftoff. tune in:  twitter.com/i/broadcasts/1?,https://twitter.com/i/broadcasts/1voxwqvywdvgb,regular tweet,en,1,954,2663,34010711,298,34010711,0.0,3617,0.01,twitter media studio,twitter.com ,twitter.com/i/broadcasts/1? ,https://twitter.com/nasa /status/1146005668853362689,https://pbs.twimg.com/profile_images/1091070803184177153/ti2qitoi_normal.jpg,,,,,,,1.14601e+18
459,459,640,tue mar 12 22:37:02 +0000 2019,nasa ,nasa,"what does the milky way weigh? ? ?? new measurements from @nasahubble and @esa's gaia mission find it's at the heavier end of the range for galaxies: its stars, supermassive black hole and dark matter total about 1.5 trillion solar masses. more: go.nasa.gov/2j6j3zn pic.twitter.com/2ibmzthdko",https://go.nasa.gov/2j6j3zn https://twitter.com/nasa/status/1105598600627798016/photo/1,regular tweet,en,0,951,4340,34010720,298,34010720,0.0,5291,0.02,sprinklr,go.nasa.gov ,go.nasa.gov/2j6j3zn ,https://twitter.com/nasa /status/1105598600627798016,https://pbs.twimg.com/profile_images/1091070803184177153/ti2qitoi_normal.jpg,,,,,,,1.1056e+18
486,486,681,tue aug 20 18:12:06 +0000 2019,nasa ,nasa,"explore with us! we've worked to send @snoopy on an educational mission to space. we're sending #astronautsnoopy on missions to visit the @space_station, fly to the moon &amp; beyond in our @nasa_orion capsule or take off with our @nasa_sls rocket + more: go.nasa.gov/2za3b6f pic.twitter.com/m6kx1fpm01",twitter analytics for #astronautsnoopy https://go.nasa.gov/2za3b6f https://twitter.com/nasa/status/1163876374643445761/photo/1,regular tweet,en,3,907,4074,34010706,298,34010706,0.0,4981,0.01,sprinklr,go.nasa.gov ,go.nasa.gov/2za3b6f ,https://twitter.com/nasa /status/1163876374643445761,https://pbs.twimg.com/profile_images/1091070803184177153/ti2qitoi_normal.jpg,,,,,,,1.16388e+18
492,492,689,sun jun 16 15:00:06 +0000 2019,nasa ,nasa,"know a dad who could use a little space this #fathersday?get lost in @nasaspitzer?s view of a nebula located about 10,000 light-years away from our home planet that?s rearing clusters of young stars: go.nasa.gov/2wppxbz pic.twitter.com/eo3rss7ftu",twitter analytics for #fathersday https://go.nasa.gov/2wppxbz https://twitter.com/nasa/status/1140272848080134147/photo/1,regular tweet,en,-2,896,5197,34010715,298,34010715,0.0,6093,0.02,sprinklr,go.nasa.gov ,go.nasa.gov/2wppxbz ,https://twitter.com/nasa /status/1140272848080134147,https://pbs.twimg.com/profile_images/1091070803184177153/ti2qitoi_normal.jpg,,,,,,,1.14027e+18
507,507,716,mon jul 08 23:04:57 +0000 2019,nasa ,nasa,fly me to the ?! we?re preparing for the launch of our first #artemis mission to the moon. get a preview of the launch countdown and see how @nasa_sls will send @nasa_orion to lunar orbit: go.nasa.gov/2nf2o1j pic.twitter.com/c2izbvhlui,twitter analytics for #artemis https://go.nasa.gov/2nf2o1j https://twitter.com/nasa/status/1148367396148862983/video/1,regular tweet,en,3,870,4460,34010711,298,34010711,0.0,5330,0.02,sprinklr,go.nasa.gov ,go.nasa.gov/2nf2o1j ,https://twitter.com/nasa /status/1148367396148862983,https://pbs.twimg.com/profile_images/1091070803184177153/ti2qitoi_normal.jpg,,,,,,,1.14837e+18
511,511,723,sun oct 06 01:25:01 +0000 2019,nasa ,nasa,"named for the mythological greek moon goddess and twin of apollo, #artemis will carry humanity back to the moon ? this time, for good ? before we launch to mars and to the unexplored beyond. get the latest updates and more, straight to your inbox: go.nasa.gov/2mkp4es pic.twitter.com/bvt2szzxpl",twitter analytics for #artemis https://go.nasa.gov/2mkp4es https://twitter.com/nasa/status/1180655162995675136/photo/1,regular tweet,en,3,864,5352,34010705,298,34010705,0.0,6216,0.02,sprinklr,go.nasa.gov ,go.nasa.gov/2mkp4es ,https://twitter.com/nasa /status/1180655162995675136,https://pbs.twimg.com/profile_images/1091070803184177153/ti2qitoi_normal.jpg,,,,,,,1.18066e+18
512,512,724,fri aug 23 00:08:00 +0000 2019,nasa ,nasa,our #artemis program will return astronauts to the moon by 2024.??? what is artemis? ? why go to the moon?? how do we get there??? when will we get there?? what will we do there?answers to these frequently asked questions: nasa.gov/what-is-artemis pic.twitter.com/m3tiajnsui,twitter analytics for #artemis https://www.nasa.gov/what-is-artemis https://twitter.com/nasa/status/1164690718851514369/photo/1,regular tweet,en,1,864,3607,34010706,298,34010706,0.0,4471,0.01,sprinklr,nasa.gov ,nasa.gov/what-is-artemis ,https://twitter.com/nasa /status/1164690718851514369,https://pbs.twimg.com/profile_images/1091070803184177153/ti2qitoi_normal.jpg,,,,,,,1.16469e+18
515,515,728,mon jul 22 15:32:06 +0000 2019,nasa ,nasa,"#artemis: twin sister of apollo, goddess of the moon and epitome of america?s next chapter in space exploration. ? with our goal of sending humans to mars, we're going back to the moon to stay and artemis is leading the way. uncover a new era: go.nasa.gov/2m4betl pic.twitter.com/mdoimrpbiy",twitter analytics for #artemis https://go.nasa.gov/2m4betl https://twitter.com/nasa/status/1153326864347344898/photo/1,regular tweet,en,1,859,4184,34010709,298,34010709,0.0,5043,0.01,sprinklr,go.nasa.gov ,go.nasa.gov/2m4betl ,https://twitter.com/nasa /status/1153326864347344898,https://pbs.twimg.com/profile_images/1091070803184177153/ti2qitoi_normal.jpg,,,,,,,1.15333e+18
517,517,730,sat jun 15 16:31:07 +0000 2019,nasa ,nasa,"starshade ? ?now let?s get in formation? ? ???? thanks to new @nasa_technology, we?re taking formation flying to the extreme! learn how starshade, a giant structure designed to travel w/ future space telescopes, will reveal new planets far from home: go.nasa.gov/2mmz9v5 pic.twitter.com/8fpvkronu6",https://go.nasa.gov/2mmz9v5 https://twitter.com/nasa/status/1139933362108424193/photo/1,regular tweet,en,0,856,4566,34010715,298,34010715,0.0,5422,0.02,sprinklr,go.nasa.gov ,go.nasa.gov/2mmz9v5 ,https://twitter.com/nasa /status/1139933362108424193,https://pbs.twimg.com/profile_images/1091070803184177153/ti2qitoi_normal.jpg,,,,,,,1.13993e+18
518,518,731,thu nov 07 01:30:07 +0000 2019,nasa ,nasa,?what is #artemis??apollo?s twin sister and our program to put the first woman and next man on the moon ?. explore the how and the why: nasa.gov/artemis pic.twitter.com/54g2avr1fd,twitter analytics for #artemis https://www.nasa.gov/artemis https://twitter.com/nasa/status/1192252859699605506/photo/1,regular tweet,en,1,855,4346,34010702,298,34010702,0.0,5201,0.02,sprinklr,nasa.gov ,nasa.gov/artemis ,https://twitter.com/nasa /status/1192252859699605506,https://pbs.twimg.com/profile_images/1091070803184177153/ti2qitoi_normal.jpg,,,,,,,1.19225e+18
526,526,740,tue sep 24 22:00:08 +0000 2019,nasa ,nasa,from absorbing whole dwarf galaxies to containing the mass of a billion stars ? black holes are a cosmic force to be reckoned with. this #blackholeweek ?we?re bringing you @nasahubble?s 5 weirdest black hole discoveries ... see for yourself ? : go.nasa.gov/2lpuwmx pic.twitter.com/xoiytosijh,twitter analytics for #blackholeweek https://go.nasa.gov/2lpuwmx https://twitter.com/nasa/status/1176617336025047050/photo/1,regular tweet,en,0,850,3955,34010704,298,34010704,0.0,4805,0.01,sprinklr,go.nasa.gov ,go.nasa.gov/2lpuwmx ,https://twitter.com/nasa /status/1176617336025047050,https://pbs.twimg.com/profile_images/1091070803184177153/ti2qitoi_normal.jpg,,,,,,,1.17662e+18
534,534,754,thu oct 10 18:02:38 +0000 2019,nasa ,nasa,take a 26 day journey to the moon? in 30 seconds. our #artemis i mission will blaze a trail for human travel to deep space as the first uncrewed flight test of the @nasa_orion spacecraft and @nasa_sls rocket. explore the mission: nasa.gov/artemis-1 pic.twitter.com/ju83nft8dv,twitter analytics for #artemis https://www.nasa.gov/artemis-1 https://twitter.com/nasa/status/1182355776586817538/video/1,regular tweet,en,2,844,4032,34010705,298,34010705,0.0,4876,0.01,sprinklr,nasa.gov ,nasa.gov/artemis-1 ,https://twitter.com/nasa /status/1182355776586817538,https://pbs.twimg.com/profile_images/1091070803184177153/ti2qitoi_normal.jpg,,,,,,,1.18236e+18
541,541,764,wed may 08 23:04:01 +0000 2019,nasa ,nasa,"no one knows when the first stars in our universe burst to life ? but @nasaspitzer has revealed clues about the epoch of reionization, a cosmic event that transformed the universe from being mostly opaque to the brilliant starscape we see today. ? more: go.nasa.gov/2puuq7s pic.twitter.com/m1reeawgit",https://go.nasa.gov/2puuq7s https://twitter.com/nasa/status/1126261499624861701/photo/1,regular tweet,en,2,838,4225,34010717,298,34010717,0.0,5063,0.01,sprinklr,go.nasa.gov ,go.nasa.gov/2puuq7s ,https://twitter.com/nasa /status/1126261499624861701,https://pbs.twimg.com/profile_images/1091070803184177153/ti2qitoi_normal.jpg,,,,,,,1.12626e+18
542,542,765,fri sep 20 21:07:00 +0000 2019,nasa ,nasa,"feeling the halloween spirit? ?this galaxy might be rising from the dead. this elliptical galaxy is considered ?dead? because it contains mostly old stars. but here, astronomers have spotted young, blue stars?hinting that it may not be ""dead"" after all: go.nasa.gov/31fzegn pic.twitter.com/nutt6pu0ty",https://go.nasa.gov/31fzegn https://twitter.com/nasa/status/1175154416883765248/photo/1,regular tweet,en,0,837,5496,34010706,298,34010706,0.0,6333,0.02,sprinklr,go.nasa.gov ,go.nasa.gov/31fzegn ,https://twitter.com/nasa /status/1175154416883765248,https://pbs.twimg.com/profile_images/1091070803184177153/ti2qitoi_normal.jpg,,,,,,,1.17515e+18
543,543,766,sun nov 03 18:38:01 +0000 2019,nasa ,nasa,"as we focus on lunar exploration, we don?t see the moon as a conclusion. it's preparation that forges a sustainable path towards mars and other worlds. our greatest adventures remain ahead of us through our #artemis program returning humans to the moon: go.nasa.gov/34znltx pic.twitter.com/rqdhpoyj1x",twitter analytics for #artemis https://go.nasa.gov/34znltx https://twitter.com/nasa/status/1191061986441867270/photo/1,regular tweet,en,2,834,5201,34010702,298,34010702,0.0,6035,0.02,sprinklr,go.nasa.gov ,go.nasa.gov/34znltx ,https://twitter.com/nasa /status/1191061986441867270,https://pbs.twimg.com/profile_images/1091070803184177153/ti2qitoi_normal.jpg,,,,,,,1.19106e+18
547,547,772,sat mar 09 23:06:01 +0000 2019,nasa ,nasa,how do we narrow the search for habitable worlds in a galaxy of hundreds of billions of stars? stars that are dimmer than the sun but brighter than the faintest stars may be the ?goldilocks? stars that are ?just right? for finding signs of life. details: go.nasa.gov/2jgan9p pic.twitter.com/jhk6qmsp4q,https://go.nasa.gov/2jgan9p https://twitter.com/nasa/status/1104518733513588736/photo/1,regular tweet,en,0,832,4443,34010720,298,34010720,0.0,5275,0.02,sprinklr,go.nasa.gov ,go.nasa.gov/2jgan9p ,https://twitter.com/nasa /status/1104518733513588736,https://pbs.twimg.com/profile_images/1091070803184177153/ti2qitoi_normal.jpg,,,,,,,1.10452e+18
552,552,780,mon jul 01 22:07:44 +0000 2019,nasa ,nasa,"?the first three minutes of our mission back to the moon are the most dangerous three minutes of the mission.? thanks to the @nasa_langley team, we are testing the @nasa_orion launch abort system to prepare for #artemis missions to the moon &amp; mars. watch: go.nasa.gov/3265h4a pic.twitter.com/mnyixib4ie",twitter analytics for #artemis https://go.nasa.gov/3265h4a https://twitter.com/nasa/status/1145816280685043712/video/1,regular tweet,en,1,819,4153,34010711,298,34010711,0.0,4972,0.01,sprinklr,go.nasa.gov ,go.nasa.gov/3265h4a ,https://twitter.com/nasa /status/1145816280685043712,https://pbs.twimg.com/profile_images/1091070803184177153/ti2qitoi_normal.jpg,,,,,,,1.14582e+18
565,565,795,mon oct 21 19:30:32 +0000 2019,nasa ,nasa,what are our next generation spacesuits???????spacesuit engineers answer the question in our latest #asknasa episode! find out the advanced features of the spacesuits that will be worn by astronauts as they explore the moon as part of the #artemis program go.nasa.gov/33txel5 pic.twitter.com/kt8mp48x5y,twitter analytics for #asknasa twitter analytics for #artemis https://go.nasa.gov/33txel5 https://twitter.com/nasa/status/1186364163771260933/video/1,regular tweet,en,0,806,4629,34010702,298,34010702,0.0,5435,0.02,sprinklr,go.nasa.gov ,go.nasa.gov/33txel5 ,https://twitter.com/nasa /status/1186364163771260933,https://pbs.twimg.com/profile_images/1091070803184177153/ti2qitoi_normal.jpg,,,,,,,1.18636e+18
571,571,803,tue jul 02 12:30:07 +0000 2019,nasa ,nasa,we successfully tested a launch abort of the @nasa_orion spacecraft that will send humans on #artemis missions to the moon &amp; mars. the test module:? traveled to an altitude of ~6 miles?? ejected 12 data recorders??? tested astronaut safetymore: go.nasa.gov/2nh5pet pic.twitter.com/qgbq3ls81w,twitter analytics for #artemis https://go.nasa.gov/2nh5pet https://twitter.com/nasa/status/1146033308964392961/photo/1,regular tweet,en,1,801,3847,34010711,298,34010711,0.0,4648,0.01,sprinklr,go.nasa.gov ,go.nasa.gov/2nh5pet ,https://twitter.com/nasa /status/1146033308964392961,https://pbs.twimg.com/profile_images/1091070803184177153/ti2qitoi_normal.jpg,,,,,,,1.14603e+18
577,577,810,tue aug 20 14:25:20 +0000 2019,nasa ,nasa,"""the #artemis mission has already begun"" says @vp pence at the #nationalspacecouncil. we're well on our way to make the mission to the moon and on to mars a reality using the @nasa_orion capsule and the @nasa_sls rocket. learn more about our efforts: nasa.gov/moontomars pic.twitter.com/hybxthxs3t",twitter analytics for #artemis twitter analytics for #nationalspacecouncil https://www.nasa.gov/moontomars https://twitter.com/nasa/status/1163819308448808960/video/1,regular tweet,en,3,795,3727,34010706,298,34010706,0.0,4522,0.01,snappytv.com,nasa.gov ,nasa.gov/moontomars ,https://twitter.com/nasa /status/1163819308448808960,https://pbs.twimg.com/profile_images/1091070803184177153/ti2qitoi_normal.jpg,,,,,,,1.16382e+18
590,590,828,mon sep 30 23:00:01 +0000 2019,nasa ,nasa,"cosmic bubbles in the milky way! ? this @nasaspitzer image shows a cloud of dust and gas filled with bubbles 10 to 30 light-years across, each containing hundreds of thousands of stars. ?click through for an annotated version pinpointing where they are: go.nasa.gov/2n31tvc pic.twitter.com/mrzob7hwd4",https://go.nasa.gov/2n31tvc https://twitter.com/nasa/status/1178806734716096514/photo/1,regular tweet,en,-4,784,3938,34010704,298,34010704,0.0,4722,0.01,sprinklr,go.nasa.gov ,go.nasa.gov/2n31tvc ,https://twitter.com/nasa /status/1178806734716096514,https://pbs.twimg.com/profile_images/1091070803184177153/ti2qitoi_normal.jpg,,,,,,,1.17881e+18
604,604,849,mon sep 09 01:33:08 +0000 2019,nasa ,nasa,our moon's storied past is part of our future. ? ??? ??? a new computer-generated kit uses @nasamoon data to bring the moon to life in unprecedented detail. the animations will help scientists find target zones for upcoming #artemis missions. see how: go.nasa.gov/2ukzza6 pic.twitter.com/unawik4pcx,twitter analytics for #artemis https://go.nasa.gov/2ukzza6 https://twitter.com/nasa/status/1170872734034866177/photo/1,regular tweet,en,0,771,4846,34010706,298,34010706,0.0,5617,0.02,sprinklr,go.nasa.gov ,go.nasa.gov/2ukzza6 ,https://twitter.com/nasa /status/1170872734034866177,https://pbs.twimg.com/profile_images/1091070803184177153/ti2qitoi_normal.jpg,,,,,,,1.17087e+18
614,614,864,mon oct 21 22:15:07 +0000 2019,nasa ,nasa,?what is #artemis??apollo?s twin sister and our program to put the first woman and next man on the moon ?. explore the how and the why: nasa.gov/artemis pic.twitter.com/ovlprhdhct,twitter analytics for #artemis https://www.nasa.gov/artemis https://twitter.com/nasa/status/1186405582326116355/photo/1,regular tweet,en,1,761,4130,34010702,298,34010702,0.0,4891,0.01,sprinklr,nasa.gov ,nasa.gov/artemis ,https://twitter.com/nasa /status/1186405582326116355,https://pbs.twimg.com/profile_images/1091070803184177153/ti2qitoi_normal.jpg,,,,,,,1.18641e+18
618,618,869,thu aug 22 21:00:02 +0000 2019,nasa ,nasa,"??? from space, a look ahead to #artemis. during yesterday's spacewalk, @astrohague carried a reminder that our missions to @space_station are paving the way for future exploration of the moon and mars: go.nasa.gov/2zenyo3what is artemis? go.nasa.gov/2zenx3t pic.twitter.com/vdpbnozqgz",twitter analytics for #artemis https://go.nasa.gov/2zenyo3 https://go.nasa.gov/2zenx3t https://twitter.com/nasa/status/1164643413431672840/photo/1,regular tweet,en,0,759,4842,34010706,298,34010706,0.0,5601,0.02,sprinklr,go.nasa.gov go.nasa.gov ,go.nasa.gov/2zenyo3 go.nasa.gov/2zenx3t ,https://twitter.com/nasa /status/1164643413431672840,https://pbs.twimg.com/profile_images/1091070803184177153/ti2qitoi_normal.jpg,,,,,,,1.16464e+18
622,622,876,sun jul 28 22:07:05 +0000 2019,nasa ,nasa,"this time, when humanity returns to the moon with our #artemis missions, we?re going to stay. we will build infrastructure &amp; develop techniques to send humans to farther destinations, such as mars. ? ?? ? here are a few things we'll learn: go.nasa.gov/2gyansq pic.twitter.com/lk10wukvxn",twitter analytics for #artemis https://go.nasa.gov/2gyansq https://twitter.com/nasa/status/1155600591646810112/video/1,regular tweet,en,2,756,4055,34010709,298,34010709,0.0,4811,0.01,sprinklr,go.nasa.gov ,go.nasa.gov/2gyansq ,https://twitter.com/nasa /status/1155600591646810112,https://pbs.twimg.com/profile_images/1091070803184177153/ti2qitoi_normal.jpg,,,,,,,1.1556e+18
628,628,883,sat jul 06 01:32:27 +0000 2019,nasa ,nasa,this week:? a milestone for @nasa_orion? a commercial lunar payload update???? more honors for a historic iconthese are a few of the stories to tell you about this week at nasa: youtu.be/bvlj_hzs_9khq pic.twitter.com/mp0ajkvqh3,https://youtu.be/bvlj_hzs_9khq https://twitter.com/nasa/status/1147317353371316224/video/1,regular tweet,en,1,751,4630,34010711,298,34010711,0.0,5381,0.02,sprinklr,youtu.be ,youtu.be/bvlj_hzs_9khq ,https://twitter.com/nasa /status/1147317353371316224,https://pbs.twimg.com/profile_images/1091070803184177153/ti2qitoi_normal.jpg,,,,,,,1.14732e+18
632,632,892,tue jul 30 02:12:01 +0000 2019,nasa ,nasa,"once completed, our @nasa_sls will be the world?s most powerful rocket, capable of sending @nasa_astronauts and supplies to and around the moon for future #artemis missions! ? check out its milestone summer progress, accelerating us to its first launch: go.nasa.gov/2gbb5dh pic.twitter.com/e8yoveebhv",twitter analytics for #artemis https://go.nasa.gov/2gbb5dh https://twitter.com/nasa/status/1156024616764051456/photo/1,regular tweet,en,6,743,4854,34010709,298,34010709,0.0,5597,0.02,sprinklr,go.nasa.gov ,go.nasa.gov/2gbb5dh ,https://twitter.com/nasa /status/1156024616764051456,https://pbs.twimg.com/profile_images/1091070803184177153/ti2qitoi_normal.jpg,,,,,,,1.15602e+18
640,640,901,sat aug 10 01:33:20 +0000 2019,nasa ,nasa,"this week:? we tested the ""powerhouse"" for our @nasa_orion spacecraft? our @marscuriosity rover is going strong after 7 years on the red planet? our @nasahubble space telescope captured a new portrait of jupiter for these stories and more, visit go.nasa.gov/2oldmsr pic.twitter.com/bivrm3iigp",https://go.nasa.gov/2oldmsr https://twitter.com/nasa/status/1160001149841358848/video/1,regular tweet,en,2,736,4071,34010709,298,34010709,0.0,4807,0.01,sprinklr,go.nasa.gov ,go.nasa.gov/2oldmsr ,https://twitter.com/nasa /status/1160001149841358848,https://pbs.twimg.com/profile_images/1091070803184177153/ti2qitoi_normal.jpg,,,,,,,1.16e+18
642,642,905,sat aug 24 01:58:11 +0000 2019,nasa ,nasa,this week:??? ??? spacewalking astronauts set up a parking spot for flights to @space_station? the sixth meeting of the national space council? a look at @nasaglenn's work on our #artemis program that will return astronauts to the moon by 2024more: go.nasa.gov/2zhf1pp pic.twitter.com/pczz41xtr7,twitter analytics for #artemis https://go.nasa.gov/2zhf1pp https://twitter.com/nasa/status/1165080835193749505/video/1,regular tweet,en,2,730,4505,34010706,298,34010706,0.0,5235,0.02,sprinklr,go.nasa.gov ,go.nasa.gov/2zhf1pp ,https://twitter.com/nasa /status/1165080835193749505,https://pbs.twimg.com/profile_images/1091070803184177153/ti2qitoi_normal.jpg,,,,,,,1.16508e+18
643,643,906,sat jun 01 15:18:40 +0000 2019,nasa ,nasa,"this week, we:?announced the first commercial robotic lunar landers to support our artemis program?discussed our exploration goals?took a look the apollo moon landings sites watch these stories and more on this week at nasa: youtu.be/gejvpyalzno pic.twitter.com/s1zljhrjlw",https://youtu.be/gejvpyalzno https://twitter.com/nasa/status/1134841699077951488/video/1,regular tweet,en,3,730,3743,34010715,298,34010715,0.0,4473,0.01,sprinklr,youtu.be ,youtu.be/gejvpyalzno ,https://twitter.com/nasa /status/1134841699077951488,https://pbs.twimg.com/profile_images/1091070803184177153/ti2qitoi_normal.jpg,,,,,,,1.13484e+18
649,649,913,thu aug 29 19:02:40 +0000 2019,nasa ,nasa,"as the first american woman in space, sally ride continues to inspire the #artemis generation of explorers who will explore the moon and eventually, mars! learn more about her trailblazing career and legacy at go.nasa.gov/2hzokxw twitter.com/barbie/status/?",twitter analytics for #artemis https://go.nasa.gov/2hzokxw https://twitter.com/barbie/status/1167105671986216961,regular tweet,en,3,723,4333,34010706,298,34010706,0.0,5056,0.01,twitter web app,go.nasa.gov twitter.com ,go.nasa.gov/2hzokxw twitter.com/barbie/status/? ,https://twitter.com/nasa /status/1167150592285904896,https://pbs.twimg.com/profile_images/1091070803184177153/ti2qitoi_normal.jpg,,,,,,,1.16715e+18
659,659,930,wed mar 27 00:52:35 +0000 2019,nasa ,nasa,in case you missed it: @vp mike pence has tasked us with landing humans on the moon by 2024. administrator @jimbridenstine replied: we are up for the challenge! learn more about plans to use our space launch system to send orion to lunar orbit:  go.nasa.gov/2fbhujt pic.twitter.com/myzput19h5,https://go.nasa.gov/2fbhujt https://twitter.com/nasa/status/1110706143217766400/video/1,regular tweet,en,2,712,2986,34010721,298,34010721,0.0,3698,0.01,sprinklr,go.nasa.gov ,go.nasa.gov/2fbhujt ,https://twitter.com/nasa /status/1110706143217766400,https://pbs.twimg.com/profile_images/1091070803184177153/ti2qitoi_normal.jpg,,,,,,,1.11071e+18
664,664,935,sun oct 20 20:05:07 +0000 2019,nasa ,nasa,we have never been more ready to meet the unknown. team members from our #artemis program share the risks and rewards of this next era of exploration as we prepare for missions to the moon and mars. watch: go.nasa.gov/32vpz0u pic.twitter.com/m8nqx712a5,twitter analytics for #artemis https://go.nasa.gov/32vpz0u https://twitter.com/nasa/status/1186010478352445457/video/1,regular tweet,en,-1,707,3915,34010702,298,34010702,0.0,4622,0.01,sprinklr,go.nasa.gov ,go.nasa.gov/32vpz0u ,https://twitter.com/nasa /status/1186010478352445457,https://pbs.twimg.com/profile_images/1091070803184177153/ti2qitoi_normal.jpg,,,,,,,1.18601e+18
672,672,945,sat oct 19 19:03:01 +0000 2019,nasa ,nasa,"the #artemis generation will be the first generation to witness humanity live sustainably and work on the moon. to celebrate, we want you to be featured on our new 3d mosaic sculpture representing our future plans. here's how to participate  ? : go.nasa.gov/2w1qtl1 pic.twitter.com/lml0bsxrxd",twitter analytics for #artemis https://go.nasa.gov/2w1qtl1 https://twitter.com/nasa/status/1185632461692293120/photo/1,regular tweet,en,3,703,4567,34010702,298,34010702,0.0,5270,0.02,sprinklr,go.nasa.gov ,go.nasa.gov/2w1qtl1 ,https://twitter.com/nasa /status/1185632461692293120,https://pbs.twimg.com/profile_images/1091070803184177153/ti2qitoi_normal.jpg,,,,,,,1.18563e+18
