936,936,1321,sat aug 03 15:05:08 +0000 2019,nasa ,nasa,"it?s #nationaltwinday &amp; our #twingoals launch in this new era of lunar exploration. #artemis, apollo's twin sister in greek mythology, is picking up where apollo left off, returning humans to deep space in prep for mars: nasa.gov/what-is-artemis pic.twitter.com/3yrv2vfdlm",twitter analytics for #nationaltwinday twitter analytics for #twingoals twitter analytics for #artemis https://www.nasa.gov/what-is-artemis https://twitter.com/nasa/status/1157668731700559873/photo/1,regular tweet,en,2,523,2797,34010709,298,34010709,0.0,3320,0.01,sprinklr,nasa.gov ,nasa.gov/what-is-artemis ,https://twitter.com/nasa /status/1157668731700559873,https://pbs.twimg.com/profile_images/1091070803184177153/ti2qitoi_normal.jpg,,,,,,,1.15767e+18
939,939,1326,sat jul 13 01:17:25 +0000 2019,nasa ,nasa,"this week, we: ??? shared a glimpse of our #artemis mission to return astronauts to the moon? tested a milestone for our @nasa_sls rocket?? mapped surface changes from recent california earthquakesfor more on these and other stories, visit: go.nasa.gov/2je0kau pic.twitter.com/jfiu9uhy9c",twitter analytics for #artemis https://go.nasa.gov/2je0kau https://twitter.com/nasa/status/1149850282806915072/video/1,regular tweet,en,1,521,2666,34010711,298,34010711,0.0,3187,0.01,sprinklr,go.nasa.gov ,go.nasa.gov/2je0kau ,https://twitter.com/nasa /status/1149850282806915072,https://pbs.twimg.com/profile_images/1091070803184177153/ti2qitoi_normal.jpg,,,,,,,1.14985e+18
943,943,1333,sat jul 27 01:34:43 +0000 2019,nasa ,nasa,"? looking for ideas for human landing systems for our #artemis mission?? showcasing @nasaaero technologies ??? celebrating our #apollo50th anniversary ? launching 5,000 pounds of cargo to the @space_stationfor a look at these stories and more, visit: go.nasa.gov/2gyuxrb pic.twitter.com/vkofyccgsz",twitter analytics for #artemis twitter analytics for #apollo50th https://go.nasa.gov/2gyuxrb https://twitter.com/nasa/status/1154928067418238980/video/1,regular tweet,en,2,519,3282,34010709,298,34010709,0.0,3801,0.01,sprinklr,go.nasa.gov ,go.nasa.gov/2gyuxrb ,https://twitter.com/nasa /status/1154928067418238980,https://pbs.twimg.com/profile_images/1091070803184177153/ti2qitoi_normal.jpg,,,,,,,1.15493e+18
945,945,1336,tue oct 08 00:00:01 +0000 2019,nasa ,nasa,"our #artemis program is bringing humanity back to the moon! but two robotic lunar orbiters initially known as artemis (acceleration, reconnection, turbulence and electrodynamics of the moon?s interaction with the sun) helped to lay the groundwork: go.nasa.gov/2iqswtp pic.twitter.com/eczo5uioy5",twitter analytics for #artemis https://go.nasa.gov/2iqswtp https://twitter.com/nasa/status/1181358551652077573/photo/1,regular tweet,en,1,518,3437,34010705,298,34010705,0.0,3955,0.01,sprinklr,go.nasa.gov ,go.nasa.gov/2iqswtp ,https://twitter.com/nasa /status/1181358551652077573,https://pbs.twimg.com/profile_images/1091070803184177153/ti2qitoi_normal.jpg,,,,,,,1.18136e+18
946,946,1337,sat jul 20 17:33:49 +0000 2019,nasa ,nasa,"we have an opportunity to take a giant leap forward for all of humanity as our #artemis program will send humans to the moon in 2024 and on to mars, says administrator @jimbridenstinewatch: twitter.com/i/broadcasts/1? pic.twitter.com/2mtdahmjle",twitter analytics for #artemis https://twitter.com/i/broadcasts/1jmkgvxvmlexl https://twitter.com/nasa/status/1152632715969060865/video/1,regular tweet,en,1,518,2530,34010709,298,34010709,0.0,3048,0.01,snappytv.com,twitter.com ,twitter.com/i/broadcasts/1? ,https://twitter.com/nasa /status/1152632715969060865,https://pbs.twimg.com/profile_images/1091070803184177153/ti2qitoi_normal.jpg,,,,,,,1.15263e+18
948,948,1342,fri jul 05 21:05:01 +0000 2019,nasa ,nasa,#hiddenfigures tells the story of 'human computers' who made spaceflight possible with their mission-critical computations. learn how these african-american pioneers paved the way for our #artemis missions to send astronauts back to the moon &amp; onto mars: go.nasa.gov/3261jtr pic.twitter.com/asje4xiohr,twitter analytics for #hiddenfigures twitter analytics for #artemis https://go.nasa.gov/3261jtr https://twitter.com/nasa/status/1147250048172007424/photo/1,regular tweet,en,0,517,2518,34010711,298,34010711,0.0,3035,0.01,sprinklr,go.nasa.gov ,go.nasa.gov/3261jtr ,https://twitter.com/nasa /status/1147250048172007424,https://pbs.twimg.com/profile_images/1091070803184177153/ti2qitoi_normal.jpg,,,,,,,1.14725e+18
950,950,1346,thu aug 08 01:05:08 +0000 2019,nasa ,nasa,"here on earth, our magnetosphere mostly deflects solar blasts from the sun and protects us from radiation. but how will our astronauts protect themselves when they journey outside of this bubble, to the moon in future #artemis missions? find out: go.nasa.gov/2ywn5m9 pic.twitter.com/jughcxkxmn",twitter analytics for #artemis https://go.nasa.gov/2ywn5m9 https://twitter.com/nasa/status/1159269277175881729/photo/1,regular tweet,en,1,516,3080,34010709,298,34010709,0.0,3596,0.01,sprinklr,go.nasa.gov ,go.nasa.gov/2ywn5m9 ,https://twitter.com/nasa /status/1159269277175881729,https://pbs.twimg.com/profile_images/1091070803184177153/ti2qitoi_normal.jpg,,,,,,,1.15927e+18
955,955,1352,fri oct 25 21:40:38 +0000 2019,nasa ,nasa,"aging stars pollute their surroundings as they burn, but galaxies recycle! ?? the cloud of dust and gas surrounding a galaxy absorbs byproducts and pushes them back in, fueling the formation of new stars. about the process &amp; a mission set to observe it: go.nasa.gov/31mo2h9 pic.twitter.com/ltza1zimhe",https://go.nasa.gov/31mo2h9 https://twitter.com/nasa/status/1187846454204870661/photo/1,regular tweet,en,-3,513,2719,34010702,298,34010702,0.0,3232,0.01,sprinklr,go.nasa.gov ,go.nasa.gov/31mo2h9 ,https://twitter.com/nasa /status/1187846454204870661,https://pbs.twimg.com/profile_images/1091070803184177153/ti2qitoi_normal.jpg,,,,,,,1.18785e+18
971,971,1375,tue apr 02 19:44:46 +0000 2019,nasa ,nasa,"arguably the best light show this festival season,  ?our @sofiatelescope captured this cosmic set sparkling on the galactic stage. these massive stars, many times larger than our sun, can affect the formation of their stellar siblings. catch the show: go.nasa.gov/2fnmxuj pic.twitter.com/mbdfav6boy",https://go.nasa.gov/2fnmxuj https://twitter.com/nasa/status/1113165396041924609/photo/1,regular tweet,en,3,507,2511,34010721,298,34010721,0.0,3018,0.01,sprinklr,go.nasa.gov ,go.nasa.gov/2fnmxuj ,https://twitter.com/nasa /status/1113165396041924609,https://pbs.twimg.com/profile_images/1091070803184177153/ti2qitoi_normal.jpg,,,,,,,1.11317e+18
977,977,1383,thu aug 15 14:55:00 +0000 2019,nasa ,nasa,what?s happening with our plans to land humans on the moon by 2024? ? hear directly from the top as administrator @jimbridenstine visits @nasa_marshall to make an announcement about our #artemis program. tune in tomorrow starting at 3:10pm et: go.nasa.gov/2z5yofx pic.twitter.com/incnuzvpzl,twitter analytics for #artemis https://go.nasa.gov/2z5yofx https://twitter.com/nasa/status/1162014835892203521/photo/1,regular tweet,en,1,503,2740,34010706,298,34010706,0.0,3243,0.01,sprinklr,go.nasa.gov ,go.nasa.gov/2z5yofx ,https://twitter.com/nasa /status/1162014835892203521,https://pbs.twimg.com/profile_images/1091070803184177153/ti2qitoi_normal.jpg,,,,,,,1.16201e+18
987,987,1393,fri may 10 19:25:07 +0000 2019,nasa ,nasa,several seasons of heavy rain and snowfall set the stage for widespread flooding along the mississippi river and its tributaries. our @nasaearth satellites recently saw flood waters exceeding the river banks and floodplains near st. louis. take a look: go.nasa.gov/2px4h6w pic.twitter.com/lu73qwqsgy,https://go.nasa.gov/2px4h6w https://twitter.com/nasa/status/1126931187241508864/photo/1,regular tweet,en,1,498,2089,34010717,298,34010717,0.0,2587,0.01,sprinklr,go.nasa.gov ,go.nasa.gov/2px4h6w ,https://twitter.com/nasa /status/1126931187241508864,https://pbs.twimg.com/profile_images/1091070803184177153/ti2qitoi_normal.jpg,,,,,,,1.12693e+18
990,990,1397,tue jul 02 11:38:01 +0000 2019,nasa ,nasa,"?by all first accounts, it was magnificent,? says @nasa_orion program manager mark kirasich. a team is now collecting 12 data recorders that were ejected from the capsule during today's ascent abort test. analysis of the data will provide insight into the abort system performance pic.twitter.com/rspxemk3vy",https://twitter.com/nasa/status/1146020198228680704/photo/1,regular tweet,en,-1,497,3078,34010711,298,34010711,0.0,3575,0.01,sprinklr,,,https://twitter.com/nasa /status/1146020198228680704,https://pbs.twimg.com/profile_images/1091070803184177153/ti2qitoi_normal.jpg,,,,,,,1.14602e+18
991,991,1398,sun mar 10 21:14:02 +0000 2019,nasa ,nasa,the spacecraft: @nasa_orionthe rocket: @nasa_slsthe spaceport: @nasagroundsysa #moon2mars ? ? ? progress update on the three systems coming together to launch astronauts from @nasakennedy on missions to explore the moon and beyond: go.nasa.gov/2td4vlc pic.twitter.com/rfavztcu4e,twitter analytics for #moon2mars https://go.nasa.gov/2td4vlc https://twitter.com/nasa/status/1104852940291014657/photo/1,regular tweet,en,3,497,2936,34010720,298,34010720,0.0,3433,0.01,sprinklr,go.nasa.gov ,go.nasa.gov/2td4vlc ,https://twitter.com/nasa /status/1104852940291014657,https://pbs.twimg.com/profile_images/1091070803184177153/ti2qitoi_normal.jpg,,,,,,,1.10485e+18
997,997,1407,wed jul 03 16:43:52 +0000 2019,nasa ,nasa,yesterday?s successful test of the launch abort system of the @nasa_orion spacecraft is another milestone for our #artemis missions to send humans to the moon and onto mars. join our experts on @reddit starting at 1pm et to ask questions: go.nasa.gov/2nevfnq pic.twitter.com/o05uz2htgk,twitter analytics for #artemis https://go.nasa.gov/2nevfnq https://twitter.com/nasa/status/1146459554382827520/photo/1,regular tweet,en,1,493,3498,34010711,298,34010711,0.0,3991,0.01,sprinklr,go.nasa.gov ,go.nasa.gov/2nevfnq ,https://twitter.com/nasa /status/1146459554382827520,https://pbs.twimg.com/profile_images/1091070803184177153/ti2qitoi_normal.jpg,,,,,,,1.14646e+18
1010,1010,1429,fri oct 25 23:30:01 +0000 2019,nasa ,nasa,space is a global frontier. that?s why we partner w/ nations around the world on everything from @space_station research to our #artemis lunar exploration program. teamwork really does makes the dream work. ? check out a few of our notable collaborations: go.nasa.gov/341fjjj pic.twitter.com/p2dmfj57id,twitter analytics for #artemis https://go.nasa.gov/341fjjj https://twitter.com/nasa/status/1187873980033703937/photo/1,regular tweet,en,2,480,3578,34010702,298,34010702,0.0,4058,0.01,sprinklr,go.nasa.gov ,go.nasa.gov/341fjjj ,https://twitter.com/nasa /status/1187873980033703937,https://pbs.twimg.com/profile_images/1091070803184177153/ti2qitoi_normal.jpg,,,,,,,1.18787e+18
1014,1014,1439,fri jul 12 01:02:44 +0000 2019,nasa ,nasa,??? what was michael collins' role as he orbited the moon alone??? how many moon rocks did we bring back during apollo?? what will #artemis astronauts bring back when they go to the moon in 2024?find the answers in our latest #apollo50th faq at: go.nasa.gov/2xtuznu #tbt pic.twitter.com/9qqcotmf1h,twitter analytics for #artemis twitter analytics for #apollo50th https://go.nasa.gov/2xtuznu twitter analytics for #tbt https://twitter.com/nasa/status/1149484199813898248/photo/1,reply,en,1,477,3744,34010711,298,1,0.0,4221,0.01,web/desktop,go.nasa.gov ,go.nasa.gov/2xtuznu ,https://twitter.com/nasa /status/1149484199813898248,https://pbs.twimg.com/profile_images/1091070803184177153/ti2qitoi_normal.jpg,,,,,,,1.14948e+18
1022,1022,1449,sat mar 23 01:33:27 +0000 2019,nasa ,nasa,a few of the stories to share this week at nasa...? two @nasa_astronauts went on a spacewalk ???????  we fired up a motor for our @nasa_orion spacecraft ??  and @osirisrex revealed big surprises about small asteroid bennu! ???watch: go.nasa.gov/2fv2x1f pic.twitter.com/alyldyrdpk,https://go.nasa.gov/2fv2x1f https://twitter.com/nasa/status/1109266875937157120/video/1,regular tweet,en,1,475,2506,34010721,298,34010721,0.0,2981,0.01,sprinklr,go.nasa.gov ,go.nasa.gov/2fv2x1f ,https://twitter.com/nasa /status/1109266875937157120,https://pbs.twimg.com/profile_images/1091070803184177153/ti2qitoi_normal.jpg,,,,,,,1.10927e+18
1024,1024,1451,fri jul 19 00:48:01 +0000 2019,nasa ,nasa,"we're going to the moon ? this time, to stay. jump over to @wired's instagram stories to check out a q&amp;a with lindsay aitchison, one of our spacesuit engineers whose work will help #artemis astronauts live and work safely on the lunar surface! ??? ???instagram.com/stories/wired pic.twitter.com/cbmcczmgol",twitter analytics for #artemis https://www.instagram.com/stories/wired https://twitter.com/nasa/status/1152017211751448577/photo/1,regular tweet,en,4,474,2473,34010709,298,34010709,0.0,2947,0.01,sprinklr,instagram.com ,instagram.com/stories/wired ,https://twitter.com/nasa /status/1152017211751448577,https://pbs.twimg.com/profile_images/1091070803184177153/ti2qitoi_normal.jpg,,,,,,,1.15202e+18
1035,1035,1466,sat jun 22 17:32:01 +0000 2019,nasa ,nasa,"""landing a woman on the moon could inspire a whole generation of young women"" said administrator @jimbridenstine when speaking with @cnn's @rachcrane about our #artemis mission to the moon that lays groundwork for going to mars. watch &amp; learn more: amp.cnn.com/cnn/2019/06/21? pic.twitter.com/52act3og57",twitter analytics for #artemis https://amp.cnn.com/cnn/2019/06/21/tech/nasa-moon-female-astronaut/index.html https://twitter.com/nasa/status/1142485406681829376/photo/1,regular tweet,en,2,470,2643,34010715,298,34010715,0.0,3113,0.01,sprinklr,amp.cnn.com ,amp.cnn.com/cnn/2019/06/21? ,https://twitter.com/nasa /status/1142485406681829376,https://pbs.twimg.com/profile_images/1091070803184177153/ti2qitoi_normal.jpg,,,,,,,1.14249e+18
1038,1038,1470,thu sep 05 17:14:31 +0000 2019,nasa ,nasa,"we are nasa. we are not just a collection of astronauts, engineers &amp; technologists. we share a dream of going farther than ever before with our #artemis missions. explore our portrait gallery &amp; learn how we?re making that dream a reality: go.nasa.gov/2ku1gpn pic.twitter.com/ohqq04w4sq",twitter analytics for #artemis https://go.nasa.gov/2ku1gpn https://twitter.com/nasa/status/1169660089264947207/photo/1,regular tweet,en,2,469,3039,34010706,298,34010706,0.0,3508,0.01,twitter web app,go.nasa.gov ,go.nasa.gov/2ku1gpn ,https://twitter.com/nasa /status/1169660089264947207,https://pbs.twimg.com/profile_images/1091070803184177153/ti2qitoi_normal.jpg,,,,,,,1.16966e+18
1043,1043,1479,sat oct 26 01:02:11 +0000 2019,nasa ,nasa,this week:? talking #artemis at #iac2019 with our international partners?????? @astro_christina &amp; @astro_jessica reflect on their #allwomanspacewalk?? our @nasawebb telescope's sunshield passes a critical testthese stories &amp; more: go.nasa.gov/2pjssol pic.twitter.com/qyhiunay7n,twitter analytics for #artemis twitter analytics for #iac2019 twitter analytics for #allwomanspacewalk https://go.nasa.gov/2pjssol https://twitter.com/nasa/status/1187897175952494592/video/1,regular tweet,en,0,466,2829,34010702,298,34010702,0.0,3295,0.01,sprinklr,go.nasa.gov ,go.nasa.gov/2pjssol ,https://twitter.com/nasa /status/1187897175952494592,https://pbs.twimg.com/profile_images/1091070803184177153/ti2qitoi_normal.jpg,,,,,,,1.1879e+18
1045,1045,1482,thu oct 17 00:57:39 +0000 2019,nasa ,nasa,dressing for the occasion! ??? ??? many missions require 2 spacesuits: 1 for spacewalks and 1 for protection during launch ? and reentry. @nasa_astronauts will wear the orange @nasa_orion suit on #artemis missions during liftoff &amp; return to earth. details: go.nasa.gov/2opwnjg pic.twitter.com/4p3gkyom83,twitter analytics for #artemis https://go.nasa.gov/2opwnjg https://twitter.com/nasa/status/1184634543803977728/photo/1,regular tweet,en,2,464,2832,34010705,298,34010705,0.0,3296,0.01,sprinklr,go.nasa.gov ,go.nasa.gov/2opwnjg ,https://twitter.com/nasa /status/1184634543803977728,https://pbs.twimg.com/profile_images/1091070803184177153/ti2qitoi_normal.jpg,,,,,,,1.18463e+18
1054,1054,1492,wed apr 10 21:05:11 +0000 2019,nasa ,nasa,"bullseye ? for the 1st time, two of our cubesats created a laser link in space! their result lays the path forward for creating a constellation of small satellites, working together to transfer more data in orbit around the earth and moon. check it out: go.nasa.gov/2g2lqcc pic.twitter.com/zreworuckh",https://go.nasa.gov/2g2lqcc https://twitter.com/nasa/status/1116084736399687680/photo/1,regular tweet,en,1,461,2622,34010719,298,34010719,0.0,3083,0.01,sprinklr,go.nasa.gov ,go.nasa.gov/2g2lqcc ,https://twitter.com/nasa /status/1116084736399687680,https://pbs.twimg.com/profile_images/1091070803184177153/ti2qitoi_normal.jpg,,,,,,,1.11608e+18
1066,1066,1507,fri oct 25 01:02:00 +0000 2019,nasa ,nasa,"we know there's water on the moon, thanks to findings from our lcross mission. but we hope to learn much more from future #artemis missions: where the water came from &amp; how it could be used as a resource by explorers. get details from @nasasciencecast: youtu.be/xvc6peur_t8 pic.twitter.com/albte80xhu",twitter analytics for #artemis https://youtu.be/xvc6peur_t8 https://twitter.com/nasa/status/1187534741291044864/video/1,regular tweet,en,2,456,2436,34010702,298,34010702,0.0,2892,0.01,twitter media studio,youtu.be ,youtu.be/xvc6peur_t8 ,https://twitter.com/nasa /status/1187534741291044864,https://pbs.twimg.com/profile_images/1091070803184177153/ti2qitoi_normal.jpg,,,,,,,1.18753e+18
1068,1068,1509,sat jun 29 21:44:06 +0000 2019,nasa ,nasa,"want more space in your inbox? subscribe to our nasa newsletter to get updates on #artemis, the latest discoveries and more: go.nasa.gov/31zuxonwe're working hard. know about it. ? pic.twitter.com/9fcdfphlxm",twitter analytics for #artemis https://go.nasa.gov/31zuxon https://twitter.com/nasa/status/1145085558538022913/photo/1,regular tweet,en,1,456,3232,34010711,298,34010711,0.0,3688,0.01,sprinklr,go.nasa.gov ,go.nasa.gov/31zuxon ,https://twitter.com/nasa /status/1145085558538022913,https://pbs.twimg.com/profile_images/1091070803184177153/ti2qitoi_normal.jpg,,,,,,,1.14509e+18
1074,1074,1516,fri jul 19 18:54:10 +0000 2019,nasa ,nasa,"earth blue, rocket red &amp; lunar silver: we have a new identity for our #artemis program that draws bold inspiration from the apollo program &amp; forges its own path, showing how #artemis will pursue lunar exploration like never before and pave the way to mars: go.nasa.gov/2lxwzzm pic.twitter.com/shocspucwt",twitter analytics for #artemis https://go.nasa.gov/2lxwzzm https://twitter.com/nasa/status/1152290549250048001/photo/1,regular tweet,en,2,454,1757,34010709,298,34010709,0.0,2211,0.01,sprinklr,go.nasa.gov ,go.nasa.gov/2lxwzzm ,https://twitter.com/nasa /status/1152290549250048001,https://pbs.twimg.com/profile_images/1091070803184177153/ti2qitoi_normal.jpg,,,,,,,1.15229e+18
1075,1075,1517,tue jun 18 21:02:00 +0000 2019,nasa ,nasa,"we're investing in american small businesses that will help us land @nasa_astronauts on the moon in five years and establish a sustainable presence there, as part of our #artemis program to explore the lunar surface. learn about these new investments: go.nasa.gov/2nanean pic.twitter.com/e4eanj6b8f",twitter analytics for #artemis https://go.nasa.gov/2nanean https://twitter.com/nasa/status/1141088699352014848/photo/1,regular tweet,en,2,454,2566,34010715,298,34010715,0.0,3020,0.01,sprinklr,go.nasa.gov ,go.nasa.gov/2nanean ,https://twitter.com/nasa /status/1141088699352014848,https://pbs.twimg.com/profile_images/1091070803184177153/ti2qitoi_normal.jpg,,,,,,,1.14109e+18
1076,1076,1518,thu oct 10 15:33:55 +0000 2019,nasa ,nasa,"new generations of stars in our milky way galaxy are recycled ? from the gas and dust of other dying stars. however, 10 years of @nasahubble ultraviolet data are showing that there is more gas coming into the galaxy than going out. explore the theories: go.nasa.gov/2m71uid pic.twitter.com/cjfw2ffugt",https://go.nasa.gov/2m71uid https://twitter.com/nasa/status/1182318347259658240/photo/1,regular tweet,en,-1,453,2349,34010705,298,34010705,0.0,2802,0.01,sprinklr,go.nasa.gov ,go.nasa.gov/2m71uid ,https://twitter.com/nasa /status/1182318347259658240,https://pbs.twimg.com/profile_images/1091070803184177153/ti2qitoi_normal.jpg,,,,,,,1.18232e+18
1088,1088,1533,thu jul 25 02:30:01 +0000 2019,nasa ,nasa,"we're heartened to hear of all the people around the world who are remembering and celebrating the #apollo50th with us. while we're honoring the past, we're also looking to the future with the #artemis missions that will return us to the moon by 2024: go.nasa.gov/2z6av8i pic.twitter.com/m0ydccfjyq",twitter analytics for #apollo50th twitter analytics for #artemis https://go.nasa.gov/2z6av8i https://twitter.com/nasa/status/1154217206684815360/photo/1,regular tweet,en,1,448,2938,34010709,298,34010709,0.0,3386,0.01,sprinklr,go.nasa.gov ,go.nasa.gov/2z6av8i ,https://twitter.com/nasa /status/1154217206684815360,https://pbs.twimg.com/profile_images/1091070803184177153/ti2qitoi_normal.jpg,,,,,,,1.15422e+18
1092,1092,1542,fri jul 05 14:18:00 +0000 2019,nasa ,nasa,a special edition of @usatoday covers our #apollo50th anniversary of the first time humans walked on another world. highlights of the ?one giant leap? edition include:? how we got to the moon??? #artemis plans to return to the lunar surface ? @nasamoon rocks &amp; artifacts pic.twitter.com/kdajfmrbwk,twitter analytics for #apollo50th twitter analytics for #artemis https://twitter.com/nasa/status/1147147622853070848/photo/1,regular tweet,en,1,446,2536,34010711,298,34010711,0.0,2982,0.01,sprinklr,,,https://twitter.com/nasa /status/1147147622853070848,https://pbs.twimg.com/profile_images/1091070803184177153/ti2qitoi_normal.jpg,,,,,,,1.14715e+18
1093,1093,1543,wed sep 18 14:57:31 +0000 2019,nasa ,nasa,"? we?re turning up the heat on our #artemis i spacecraft, testing @nasa_orion under extreme simulated in-space conditions. with a job like returning humans to the moon by 2024, this craft must be ready for anything. check out its training regime ? : go.nasa.gov/2obp6b9 pic.twitter.com/wtfucrthjp",twitter analytics for #artemis https://go.nasa.gov/2obp6b9 https://twitter.com/nasa/status/1174336657639784448/photo/1,regular tweet,en,3,445,2586,34010706,298,34010706,0.0,3031,0.01,sprinklr,go.nasa.gov ,go.nasa.gov/2obp6b9 ,https://twitter.com/nasa /status/1174336657639784448,https://pbs.twimg.com/profile_images/1091070803184177153/ti2qitoi_normal.jpg,,,,,,,1.17434e+18
1094,1094,1544,fri jul 19 12:30:07 +0000 2019,nasa ,nasa,leap ahead to 2024: the first woman and the next man to land on the moon are exploring the lunar south pole. what will they learn? here's what the #artemis missions will teach us about living and working in deep space: go.nasa.gov/2m0evnk pic.twitter.com/w51yblan2r,twitter analytics for #artemis https://go.nasa.gov/2m0evnk https://twitter.com/nasa/status/1152193901119324160/photo/1,regular tweet,en,1,445,2194,34010709,298,34010709,0.0,2639,0.01,sprinklr,go.nasa.gov ,go.nasa.gov/2m0evnk ,https://twitter.com/nasa /status/1152193901119324160,https://pbs.twimg.com/profile_images/1091070803184177153/ti2qitoi_normal.jpg,,,,,,,1.15219e+18
1106,1106,1560,tue jul 30 21:20:24 +0000 2019,nasa ,nasa,explore our #artemis mission: how we'll get there ?our lunar outpost ?expeditions to the moon ??? ???we've broken down how it will establish sustainable lunar exploration and set us on a path to mars. discover a new era of space exploration: go.nasa.gov/2zls8wd pic.twitter.com/stngpab0d1,twitter analytics for #artemis https://go.nasa.gov/2zls8wd https://twitter.com/nasa/status/1156313619027681280/video/1,regular tweet,en,0,440,2296,34010709,298,34010709,0.0,2736,0.01,sprinklr,go.nasa.gov ,go.nasa.gov/2zls8wd ,https://twitter.com/nasa /status/1156313619027681280,https://pbs.twimg.com/profile_images/1091070803184177153/ti2qitoi_normal.jpg,,,,,,,1.15631e+18
1113,1113,1569,sat jul 06 23:07:02 +0000 2019,nasa ,nasa,"? our 355-ft mobile launcher rolled out at @nasakennedy for a final round of testing. this giant structure is used to launch rockets! ?next time it rolls out, we'll use it to stack @nasa_orion atop @nasa_sls for the first #artemis moon mission. more: go.nasa.gov/2nbidgp pic.twitter.com/jl0uepr03z",twitter analytics for #artemis https://go.nasa.gov/2nbidgp https://twitter.com/nasa/status/1147643143166267392/photo/1,regular tweet,en,4,437,3382,34010711,298,34010711,0.0,3819,0.01,sprinklr,go.nasa.gov ,go.nasa.gov/2nbidgp ,https://twitter.com/nasa /status/1147643143166267392,https://pbs.twimg.com/profile_images/1091070803184177153/ti2qitoi_normal.jpg,,,,,,,1.14764e+18
1123,1123,1581,wed sep 25 01:18:01 +0000 2019,nasa ,nasa,"#artemis is the twin sister of apollo, goddess of the moon and epitome of america?s next chapter in space exploration. ? read more from @jimbridenstine about how we will take what we learn at the lunar surface, and head to mars: go.nasa.gov/2mtsswk pic.twitter.com/ff4q9mcikq",twitter analytics for #artemis https://go.nasa.gov/2mtsswk https://twitter.com/nasa/status/1176667137273999360/photo/1,regular tweet,en,1,435,2489,34010704,298,34010704,0.0,2924,0.01,sprinklr,go.nasa.gov ,go.nasa.gov/2mtsswk ,https://twitter.com/nasa /status/1176667137273999360,https://pbs.twimg.com/profile_images/1091070803184177153/ti2qitoi_normal.jpg,,,,,,,1.17667e+18
